[
    {
        "board_id": "let",
        "closure_state": "EVIDENCE_EXHAUSTED",
        "operational_state": "FOUNDATION_SUFFICIENT",
        "evidence_exhausted": true,
        "numerical_headroom": null,
        "evidence_headroom": 0,
        "text_format_headroom": 0,
        "high_value_headroom": 0,
        "closure_reason": "Batch652 consumed the exact high-confidence LET cohort and recorded no remaining high-value proposition. Numeric thinness remains a planning signal only.",
        "reviewed_at_batch": 656
    }
]
